{
  "schema_version": "1.0",
  "dataset_version": "2026-09-17.1",
  "id": "seocho-infertility-preparation",
  "data_mode": "official_sources",
  "review_status": "human_review_pending",
  "scope": {
    "district": "seocho",
    "marriage": "legal",
    "household": "synthetic_foreign_wife_korean_husband",
    "stage": "before_treatment",
    "description": "신청 준비와 기관 확인을 위한 합성 사례. 개인별 최종 자격 판정은 제공하지 않음."
  },
  "sources": [
    {
      "id": "S-SEOCHO",
      "title": "난임부부시술비지원",
      "publisher": "서초구 보건소",
      "url": "https://www.seocho.go.kr/site/sh/03/10304050101002020031910.jsp",
      "checked_at": "2026-09-17",
      "updated_at": null,
      "checked_by": "Codex — 공개 원문 대조",
      "human_reviewer": null
    },
    {
      "id": "S-SEOUL",
      "title": "서울시 난임부부 시술비 지원사업",
      "publisher": "서울시 임신·출산 정보센터",
      "url": "https://seoul-agi.seoul.go.kr/ifc-csp",
      "checked_at": "2026-09-17",
      "updated_at": null,
      "checked_by": "Codex — 공개 원문 대조",
      "human_reviewer": null
    }
  ],
  "claims": [
    {
      "id": "C-01",
      "text": {"ko": "부부 중 주민등록된 한국 국적자가 있고, 두 사람의 건강보험 가입·보험료 고지를 확인해야 합니다.", "ja": "夫婦の一方が住民登録のある韓国籍で、双方の健康保険加入・保険料通知を確認する必要があります。"},
      "source_ids": ["S-SEOCHO"],
      "locations": ["지원신청 자격"],
      "evidence_status": "source_checked",
      "human_reviewer": null
    },
    {
      "id": "C-02",
      "text": {"ko": "외국인 아내의 방문신청은 한국인 남편 주소지 관할로 안내됩니다.", "ja": "外国籍の妻の場合、訪問申請は韓国人の夫の住所地の管轄窓口と案内されています。"},
      "source_ids": ["S-SEOCHO"],
      "locations": ["신청방법 → 방문신청"],
      "evidence_status": "source_checked",
      "human_reviewer": null
    },
    {
      "id": "C-03",
      "text": {"ko": "서초구 문의 창구: 양재모자건강센터 모성영유아의료비지원실, 02-2155-8135.", "ja": "瑞草区の問い合わせ先：양재모자건강센터 모성영유아의료비지원실、02-2155-8135。"},
      "source_ids": ["S-SEOCHO"],
      "locations": ["문의"],
      "evidence_status": "source_checked",
      "human_reviewer": null
    },
    {
      "id": "C-04",
      "text": {"ko": "진단서·등본·부부 보험 자료·가족관계증명서·동의서·방문 신분증을 확인합니다. 공동이용 동의 시 등본·보험 자료 제출 생략 조건이 있습니다. 개인별 추가서류는 문의하세요.", "ja": "診断書・住民登録謄本・夫婦の保険資料・家族関係証明書・同意書・訪問時の身分証を確認します。行政情報の共同利用に同意すると謄本・保険資料を省略できる条件があります。個別の追加書類は窓口で確認してください。"},
      "source_ids": ["S-SEOCHO"],
      "locations": ["구비서류; 첫 신청 준비 범위의 요약"],
      "evidence_status": "source_checked",
      "human_reviewer": null
    },
    {
      "id": "C-05",
      "text": {"ko": "신청 후 보건소가 자격을 확인하고 통지서를 발급하며, 의료기관에 제출하는 순서입니다.", "ja": "申請後、保健所が資格を確認して通知書を発行し、医療機関に提出する流れです。"},
      "source_ids": ["S-SEOUL"],
      "locations": ["지원절차 1~3"],
      "evidence_status": "source_checked",
      "human_reviewer": null
    },
    {
      "id": "C-06",
      "text": {"ko": "통지서 유효기간이 서초구 6개월·서울시 종합 안내 3개월로 다릅니다. 적용 기한은 담당기관에 확인하세요.", "ja": "通知書の有効期間が瑞草区では6か月、ソウル市の総合案内では3か月と異なります。適用期間は担当窓口に確認してください。"},
      "source_ids": ["S-SEOCHO", "S-SEOUL"],
      "locations": ["신청방법 ③", "지원절차 2"],
      "evidence_status": "conflicting",
      "human_reviewer": null
    },
    {
      "id": "C-07",
      "text": {"ko": "체류 증빙이 필요한 범위를 두 안내만으로 확정하기 어렵습니다. 법률혼 가구에도 필요한지 문의하세요.", "ja": "在留証明が必要な範囲は両案内だけでは確定できません。法律婚の世帯にも必要か確認してください。"},
      "source_ids": ["S-SEOCHO", "S-SEOUL"],
      "locations": ["사실상 혼인관계 추가서류", "추가서류 2"],
      "evidence_status": "needs_confirmation",
      "human_reviewer": null
    },
    {
      "id": "C-08",
      "text": {"ko": "외국인 당사자의 온라인 본인인증·신청 및 배우자 대리 가능 여부는 별도 확인이 필요합니다.", "ja": "外国籍の申請者のオンライン本人認証・申請や配偶者による代理の可否は、別途確認が必要です。"},
      "source_ids": ["S-SEOCHO"],
      "locations": ["온라인 신청 설명만으로 개인별 이용 가능성을 확정할 수 없음"],
      "evidence_status": "needs_confirmation",
      "human_reviewer": null
    }
  ],
  "tasks": [
    {
      "id": "check-scope",
      "title": {"ko": "우리 상황과 문의 창구 확인", "ja": "状況と問い合わせ先を確認"},
      "reason": {"ko": "첫 단계에서 적용 범위와 모르는 조건을 구분해요.", "ja": "最初に案内の対象範囲と未確認の条件を整理します。"},
      "claim_ids": ["C-01", "C-02", "C-03"],
      "depends_on": [],
      "owner": "together",
      "status": "todo",
      "applicability": "needs_confirmation",
      "deadline": null
    },
    {
      "id": "check-documents",
      "title": {"ko": "준비 서류와 추가 확인 나누기", "ja": "準備書類と追加確認を整理"},
      "reason": {"ko": "내가 준비할 것과 배우자와 확인할 것을 정해요.", "ja": "自分で準備することと配偶者と確認することを決めます。"},
      "claim_ids": ["C-04", "C-07"],
      "depends_on": ["check-scope"],
      "owner": "user",
      "status": "todo",
      "applicability": "needs_confirmation",
      "deadline": null
    },
    {
      "id": "check-channel",
      "title": {"ko": "신청 경로와 본인 확인 방법 문의", "ja": "申請方法と本人確認について相談"},
      "reason": {"ko": "실제로 이용할 수 있는 경로인지 먼저 확인해요.", "ja": "実際に利用できる申請方法か、先に確認します。"},
      "claim_ids": ["C-03", "C-08"],
      "depends_on": ["check-scope"],
      "owner": "together",
      "status": "todo",
      "applicability": "needs_confirmation",
      "deadline": null
    },
    {
      "id": "prepare-application",
      "title": {"ko": "확인한 경로에서 신청 준비", "ja": "確認した方法で申請を準備"},
      "reason": {"ko": "준비와 기관의 실제 접수를 구분해 기록해요.", "ja": "準備と窓口での実際の受付を区別して記録します。"},
      "claim_ids": ["C-05", "C-08"],
      "depends_on": ["check-documents", "check-channel"],
      "owner": "together",
      "status": "todo",
      "applicability": "needs_confirmation",
      "deadline": null
    },
    {
      "id": "check-notice",
      "title": {"ko": "통지서 발급 상태와 기한 확인", "ja": "通知書の発行状況と期限を確認"},
      "reason": {"ko": "자료가 다른 항목을 놓치지 않고 질문해요.", "ja": "案内が食い違う項目を見落とさずに確認します。"},
      "claim_ids": ["C-03", "C-05", "C-06"],
      "depends_on": ["prepare-application"],
      "owner": "user",
      "status": "todo",
      "applicability": "needs_confirmation",
      "deadline": null
    },
    {
      "id": "prepare-clinic",
      "title": {"ko": "의료기관 제출 준비 확인", "ja": "医療機関への提出準備を確認"},
      "reason": {"ko": "앱의 완료 표시와 실제 제출 결과를 구분해요.", "ja": "アプリ上の完了記録と実際の提出結果を区別します。"},
      "claim_ids": ["C-05", "C-06"],
      "depends_on": ["check-notice"],
      "owner": "together",
      "status": "todo",
      "applicability": "needs_confirmation",
      "deadline": null
    }
  ]
}
